product_id,brewery_id,brewery_name_jp,name_jp,name_zhtw,area_jp,area_zhtw,sake_type,rice_variety,rice_origin,seimaibuai,yeast,abv,smv,acidity,amino_acid,flavor_f1_華やか,flavor_f2_芳醇,flavor_f3_重厚,flavor_f4_穏やか,flavor_f5_ドライ,flavor_f6_軽快,flavor_tags,flavor_tags_jp,sakenowa_brand_id,sakenowa_brand_url,updated_at,description,tasting_note,pairing,content_generated_at,content_model
sn_3325,6,高砂酒造,ずZOOっと旭山,,北海道,北海道,,,,,,,,,,0.12227093470756036,0.5424480773215662,0.4325008655292566,0.5605404520602713,0.32437557628754676,0.2903752578380401,カラメル,カラメル,3325,https://sakenowa.com/brands/3325,2026-05-12T04:20:02.172130+00:00,"高砂酒造位於北海道,以當地風土與釀造傳統為基礎。本款「ずZOOっと旭山」展現濃醇與穩重並行的特質,風味雷達顯示芳醇感略佔上風,同時保有一定的厚重感,整體呈現溫和的辛口調性。焦糖調的風味標籤暗示了此酒蘊含深邃的熟成感與甘甜層次。","常溫或溫燗(40-45°C)品飲最佳。香氣內斂帶焦糖與麥芽感,入口濃醇飽滿,酒體厚實有質感,中段展現溫暖的甘味,尾韻乾淨悠長。整體沉穩不張揚,適合細細體會。","適合搭配燒鳥(特別是雞腿、雞翅等油脂豐富的部位),濃醇的酒體與烤物的香氣相襯,焦糖感呼應醬烤的深度。也可搭配白切雞或麻油雞,溫暖的酒質柔和肉的鮮甜,尾韻的乾爽感清口。",2026-05-12T04:22:01.802559+00:00,claude-haiku-4-5-20251001
sn_11,7,小林酒造,北の錦,,北海道,北海道,,,,,,,,,,0.3181595366636158,0.5460449102884503,0.4249636277824494,0.4874544301313453,0.2718761649248254,0.32937351097370576,"ほのか,鮮味,辛口,とろみ,果香,麝香葡萄,甘甜,濃厚,清爽,荒々しい,薄い,華麗,醇厚,紹興酒,酸味,苦味,清新,ジュース,どっしり,しっかり","ほのか,旨味,辛口,とろみ,フルーティ,マスカット,甘味,濃厚,スッキリ,荒々しい,薄い,華やか,コク,紹興酒,酸味,苦味,さわやか,ジュース,どっしり,しっかり",11,https://sakenowa.com/brands/11,2026-05-12T04:20:02.172313+00:00,"小林酒造位於北海道,承襲北方的冷涼風土釀造。北の錦展現濃醇與穩重並行的特性,風味輪廓上兼具醇厚感與清新感的平衡。根據用戶評價,這款酒帶有鮮味與麝香葡萄的果香,同時具備適度的辛口特質,屬於層次豐富、適應力強的北海道代表作。","常溫或冷飲皆宜。香氣融合鮮果與麝香葡萄的溫暖調性,入口有明顯醇厚與濃厚感,中段帶出清爽的辛口框架,尾韻乾淨收斂,餘韻中保留淡淡果香與鮮味。","適合搭配燒鳥與炙烤海鮮,濃醇的酒體能承托焦香與肉汁的厚度。也推薦配白切雞或清蒸海魚,辛口的骨架與鮮味相呼應,讓海鮮的細緻風味更顯立體。",2026-05-12T04:22:06.544418+00:00,claude-haiku-4-5-20251001
sn_1275,7,小林酒造,まる田,,北海道,北海道,,,,,,,,,,0.25997936823996914,0.4100081927901967,0.34092486066852123,0.5996123635393338,0.361941411026431,0.39691016337148977,,,1275,https://sakenowa.com/brands/1275,2026-05-12T04:20:02.172318+00:00,"小林酒造坐落於北海道,汲取當地清冽的水質與寒冷氣候的釀造優勢。「まる田」展現出穩重與濃醇兼具的風味特徵,風味雷達顯示酒體偏向沉穩內斂,帶有適度的厚重感與芳醇度,同時保有輕快的一面,屬於平衡型的北海道清酒風格。","建議常溫或冷酒品飲。香氣內斂不張揚,入口呈現溫厚的米香與淡淡的甜感,中段飽滿度適中,尾韻略帶辛口乾爽,收尾倐然而止,整體予人穩健沉靜的印象。","搭配白切雞或清蒸海魚能襯出酒的溫厚米香,不搶食材風味。也適合燒鳥或關東煮,其穩重的酒體能平衡烤物的油膩感,輔以輕快的尾韻增進食慾。",2026-05-12T04:22:11.185591+00:00,claude-haiku-4-5-20251001
sn_1794,7,小林酒造,北斗随想,,北海道,北海道,,,,,,,,,,0.5095947556442934,0.5062036854882678,0.17344504735032368,0.4709610436051199,0.19394028950835426,0.4411016763506615,"果香,鮮味,荒々しい","フルーティ,旨味,荒々しい",1794,https://sakenowa.com/brands/1794,2026-05-12T04:20:02.172324+00:00,小林酒造位處北海道，北國的冷冽氣候與清冽水質為釀造奠定基礎。北斗随想展現華麗與濃醇的平衡特質，風味輪廓既有優雅的果香與鮮明的鮮味，又保持穩重的酒體。整體呈現輕快與芳醇兼具的特色，是一款層次豐富的北海道之作。,冷飲至常溫最佳。香氣中果香與野性的荒々しい(粗獷)氣質並存，帶來清新卻不失力度的印象。口感鮮味突出，酸度適中，尾韻乾淨利落，留下清爽的餘韻。,適合搭配握壽司與生魚片，酒中的鮮味與海鮮相襯，突顯食材的甜度。亦可配白切雞或清蒸海魚，輕快的酒體不搶食物的風采，反而襯托其清甜。燒鳥也是好搭檔，酒的果香消解油膩感。,2026-05-12T04:22:15.718794+00:00,claude-haiku-4-5-20251001
sn_3756,7,小林酒造,北の錦 真冬詰 大吟醸,,北海道,北海道,,,,,,,,,,,,,,,,,,3756,https://sakenowa.com/brands/3756,2026-05-12T04:20:02.172328+00:00,"小林酒造位於北海道,承襲北方釀酒的傳統。「北之錦 真冬詰」以大吟釀規格呈現,冬季低溫釀造是此款的核心特點。冷冽的北海道氣候與精心控管的釀造溫度,賦予酒體清爽俐落的調性,展現出大吟釀應有的細膩與優雅。","建議冷飲(5-10°C)享用,讓低溫釀造的特色充分展現。酒質輕盈清淨,香氣內斂,入口溫和順滑,尾韻乾淨俐落,餘韻悠長。整體呈現北海道冬釀特有的潔淨感。","推薦搭配白身生魚片或淡雪蟹,清新的酒質不會掩蓋海味的細緻甜度。亦適合佐以清蒸白魚或關東煮,冷冽的酒體與清湯料理相得益彰,凸顯彼此的純粹。",2026-05-12T04:22:20.150007+00:00,claude-haiku-4-5-20251001
